{
  "season": "2025-2026",
  "updated": "2026-02-23",
  "first": "2025-11-10",
  "last": "2026-02-19",
  "days": ["Monday", "Tuesday", "Wednesday", "Thursday"],
  "time": "3:30-4:30 PM",
  "location": "WARF",
  "changes": [
    {"date": "2025-11-26", "through": "2025-11-27", "off": true, "note": "Thanksgiving break"},
    {"date": "2025-12-24", "through": "2025-12-25", "off": true, "note": "Winter break"},
    {"date": "2025-12-29", "through": "2026-01-01", "off": true, "note": "Winter break"},
    {"date": "2026-02-18", "off": true, "note": "Before States"}
  ]
}
